{
  "axes": {
    "grid": true,
    "kind": "box",
    "x": {
      "label": "x (µm)",
      "lim": [
        -1,
        1
      ],
      "ticks": [
        -1,
        0,
        1
      ]
    },
    "y": {
      "label": "y (µm)",
      "lim": [
        -1,
        1
      ],
      "ticks": [
        -1,
        0,
        1
      ]
    },
    "z": {
      "label": "z (µm)",
      "lim": [
        -1,
        1
      ],
      "ticks": [
        -1,
        0,
        1
      ]
    }
  },
  "bounds": {
    "max": [
      1.0,
      1.0,
      1.0
    ],
    "min": [
      -1.0,
      -1.0,
      -1.0
    ]
  },
  "build": {
    "generator": "fluxplot scene3d contract 0.1.0"
  },
  "glb": "box-axes.glb",
  "glbSha256": "ae3568b49287d7b8cc2a7eef74bb6bc27da0d413a201ffecf490a2457246bd90",
  "lighting": "studio",
  "order": [
    "sample.mesh",
    "axes.x.label",
    "axes.x.ticks",
    "axes.x.grid",
    "axes.x.pane",
    "axes.x.axis",
    "axes.y.label",
    "axes.y.ticks",
    "axes.y.grid",
    "axes.y.pane",
    "axes.y.axis",
    "axes.z.label",
    "axes.z.ticks",
    "axes.z.grid",
    "axes.z.pane",
    "axes.z.axis"
  ],
  "parts": [
    {
      "color": "#4385BE",
      "id": "sample.mesh",
      "kind": "mesh",
      "label": "mesh",
      "node": "sample.mesh",
      "role": "mesh",
      "series": "sample"
    },
    {
      "id": "axes.x.label",
      "kind": "furniture",
      "role": "axis-title",
      "text": "x (µm)"
    },
    {
      "id": "axes.x.ticks",
      "kind": "furniture",
      "role": "tick-label"
    },
    {
      "id": "axes.x.grid",
      "kind": "furniture",
      "role": "gridline"
    },
    {
      "id": "axes.x.pane",
      "kind": "furniture",
      "role": "pane"
    },
    {
      "id": "axes.x.axis",
      "kind": "furniture",
      "role": "axis"
    },
    {
      "id": "axes.y.label",
      "kind": "furniture",
      "role": "axis-title",
      "text": "y (µm)"
    },
    {
      "id": "axes.y.ticks",
      "kind": "furniture",
      "role": "tick-label"
    },
    {
      "id": "axes.y.grid",
      "kind": "furniture",
      "role": "gridline"
    },
    {
      "id": "axes.y.pane",
      "kind": "furniture",
      "role": "pane"
    },
    {
      "id": "axes.y.axis",
      "kind": "furniture",
      "role": "axis"
    },
    {
      "id": "axes.z.label",
      "kind": "furniture",
      "role": "axis-title",
      "text": "z (µm)"
    },
    {
      "id": "axes.z.ticks",
      "kind": "furniture",
      "role": "tick-label"
    },
    {
      "id": "axes.z.grid",
      "kind": "furniture",
      "role": "gridline"
    },
    {
      "id": "axes.z.pane",
      "kind": "furniture",
      "role": "pane"
    },
    {
      "id": "axes.z.axis",
      "kind": "furniture",
      "role": "axis"
    }
  ],
  "plotType": "scene3d",
  "schemaVersion": "0.1.0",
  "size": {
    "height": 3,
    "unit": "in",
    "width": 3.5
  },
  "spec": "fluxplot/scene3d",
  "style": {
    "font": "Inter",
    "fontSizePt": 7,
    "ink": "#100F0F",
    "lineWidthPt": 0.6,
    "muted": "#6F6E69",
    "titleSizePt": 8
  },
  "toWorld": [
    1.0,
    0.0,
    0.0,
    0.0,
    0.0,
    1.0,
    0.0,
    0.0,
    0.0,
    0.0,
    1.0,
    0.0,
    0.0,
    0.0,
    0.0,
    1.0
  ],
  "units": "µm",
  "view": {
    "azimuth": 30,
    "elevation": 20,
    "projection": "orthographic",
    "zoom": 0.9
  }
}
