{
  "axes": {
    "kind": "none"
  },
  "bounds": {
    "max": [
      2.2,
      1.0,
      1.0
    ],
    "min": [
      -2.2,
      -1.0,
      -1.0
    ]
  },
  "build": {
    "generator": "fluxplot scene3d contract 0.1.0"
  },
  "glb": "morph-a.glb",
  "glbSha256": "27fde047d7b772d2c294eb64f29221b986647d2c6efe18d2f414277ce2437f2b",
  "lighting": "studio",
  "morphGroup": "cortex",
  "order": [
    "cortex.left",
    "cortex.right"
  ],
  "parts": [
    {
      "color": "#4385BE",
      "id": "cortex.left",
      "kind": "mesh",
      "label": "left",
      "node": "cortex.left",
      "role": "mesh",
      "series": "cortex"
    },
    {
      "color": "#3AA99F",
      "id": "cortex.right",
      "kind": "mesh",
      "label": "right",
      "node": "cortex.right",
      "role": "mesh",
      "series": "cortex"
    }
  ],
  "plotType": "scene3d",
  "schemaVersion": "0.1.0",
  "size": {
    "height": 3,
    "unit": "in",
    "width": 3.5
  },
  "spec": "fluxplot/scene3d",
  "style": {
    "font": "Inter",
    "fontSizePt": 7,
    "ink": "#100F0F",
    "lineWidthPt": 0.6,
    "muted": "#6F6E69",
    "titleSizePt": 8
  },
  "toWorld": [
    1.0,
    0.0,
    0.0,
    0.0,
    0.0,
    1.0,
    0.0,
    0.0,
    0.0,
    0.0,
    1.0,
    0.0,
    0.0,
    0.0,
    0.0,
    1.0
  ],
  "units": "µm",
  "view": {
    "azimuth": 30,
    "elevation": 20,
    "projection": "orthographic",
    "zoom": 0.9
  }
}
