{
  "axes": {
    "kind": "none"
  },
  "bounds": {
    "max": [
      1.0,
      1.0,
      1.0
    ],
    "min": [
      -1.0,
      -1.0,
      -1.0
    ]
  },
  "build": {
    "generator": "fluxplot scene3d contract 0.1.0"
  },
  "glb": "scalebar.glb",
  "glbSha256": "ae3568b49287d7b8cc2a7eef74bb6bc27da0d413a201ffecf490a2457246bd90",
  "lighting": "studio",
  "order": [
    "sample.mesh",
    "scalebar"
  ],
  "parts": [
    {
      "color": "#4385BE",
      "id": "sample.mesh",
      "kind": "mesh",
      "label": "mesh",
      "node": "sample.mesh",
      "role": "mesh",
      "series": "sample"
    },
    {
      "id": "scalebar",
      "kind": "furniture",
      "label": "0.5 µm",
      "length": 0.5,
      "role": "scalebar"
    }
  ],
  "plotType": "scene3d",
  "schemaVersion": "0.1.0",
  "size": {
    "height": 3,
    "unit": "in",
    "width": 3.5
  },
  "spec": "fluxplot/scene3d",
  "style": {
    "font": "Inter",
    "fontSizePt": 7,
    "ink": "#100F0F",
    "lineWidthPt": 0.6,
    "muted": "#6F6E69",
    "titleSizePt": 8
  },
  "toWorld": [
    1.0,
    0.0,
    0.0,
    0.0,
    0.0,
    1.0,
    0.0,
    0.0,
    0.0,
    0.0,
    1.0,
    0.0,
    0.0,
    0.0,
    0.0,
    1.0
  ],
  "units": "µm",
  "view": {
    "azimuth": 30,
    "elevation": 20,
    "projection": "orthographic",
    "zoom": 0.9
  }
}
